INPUT:text1	INPUT:text2	INPUT:result	INPUT:comment	INPUT:source1	INPUT:source2	INPUT:summ_text1	INPUT:summ_text2	INPUT:main_result	INPUT:explanation_who	INPUT:explanation_what	INPUT:explanation_when	INPUT:explanation_where	INPUT:summ_with_documents_text1	INPUT:summ_with_documents_text2	GOLDEN:understood	TASK:id	TASK:overlap	TASK:assignments_count	TASK:correct_answers_percent
"Ванесса Браянт отримала компенсацію за те, що посмертні фото її чоловіка й дочки Джіанни опинилися у вільному доступі.

Відомий баскетболіст Кобі Браянт розбився під час аварії вертольота у 2020 році. А його вдова Ванесса Браянт подала в суд на округ Лос-Анджелес після того, як працівники екстрених служб фотографували тіла загиблих на місці краху та розсилали їх друзям і знайомим. Про це пише Daily Mail.

Ванесса Браянт відсудила 16 мільйонів доларів в округу за вторгнення в приватне життя.

Ванесса Браянт із дочкою Наталією Фото: Instagram Vanessa Bryant

Присяжні в Лос-Анджелесі розпочали обговорення багатомільйонного цивільного процесу в середу вранці та винесли вердикт менш ніж за добу.

Браянт плакала, коли рішення оголосили наприкінці двотижневого судового розгляду, під час якого суд заслухав свідчення про відверті фотографії загиблих.

Кобі Браянт із донькою Джіанною Фото: Instagram Vanessa Bryant

Виявилося, що помічники шерифа та пожежники, які прибули на місце аварії в січні 2020 року, сфотографували місце аварії і тіла загиблих.

Деякі з цих фотографій працівники спецслужб показали своїм знайомим, а один із шерифів — їхньому другу, поки пара грала у відеоігри.

На свій захист округ Лос-Анджелес заявляє, що фотографії ніколи не публікувалися, і чиновники доклали всіх зусиль, щоб видалити їх із пристроїв.

Але Ванесса Браянт і Кріс Честер, чия дружина й дочка також загинули в авіакатастрофі, живуть у страху, що якось ці фотографії з'являться в інтернеті.

Кобі Браянт і Ванесса Брайант Фото: Instagram Vanessa Bryant

Пара подала в суд за емоційні збитки через фотографії в об'єднаних позовах: Честеру, який втратив в авіакатастрофі дружину Сару та 13-річну доньку Пейтон, присудили 15 мільйонів доларів, Ванессі Браянт — 16 мільйонів доларів.

Присяжні з'ясували, що рятувальники зазвичай не діляться фотографіями загиблих, але виявилося, що суворих правил щодо цього немає. Вони дійшли висновку, що в департаменті шерифа існує практика обміну фотографіями з подій, а також недостатня підготовка до таких моментів.

Нагадаємо, Кобі Браянт був п'ятикратним чемпіоном НБА, його кар'єра розпочалася в 1996 році відразу після школи й тривала до виходу на пенсію у 2016 році.

Він грав за ""Лос-Анджелес Лейкерс"". У 2020 році Кобі Браянт і його дочка Джіанна розбилися під час аварії вертольота Sikorsky S-76. Окрім них, на борту були ще вісім людей, у тому числі й бейсбольний тренер Кері Атобеллі з дружиною та донькою. Усі вони загинули."	"7 лютого відбулися похорони легендарного гравця НБА Кобі Брайанта і його 13-річної доньки Джанни.

Церемонія пройшла в Меморіальному парку Pacific View в Корона-дель-Мар, Каліфорнія. Про це повідомляє The Los Angeles Times.

Офіційна церемонія прощання з Брайантом відбудеться 24 лютого на арені «Лос-Анджелес Лейкерс» «Стейплс-центр».

Нагадаємо, що 26 січня гелікоптер із Брайантом на борту розбився в місті Калабасос. Брайант, його 13-річна донька і ще 7 людей загинули на місці."	"{""who_same"":""partly"",""when_same"":""no"",""where_same"":""partly""}"	Смерть в авіакатастрофі відомого НБА гравця Кобі Браяна, його доньки та його друзів і її вплив на їхніх близьких	http://news.google.com/articles/CBMifGh0dHBzOi8vZm9jdXMudWEvdWsvbGlmZXN0eWxlLzUyNjc4OC12ZG92YS1iYXNrZXRib2xpc3RhLWtvYmktYnJheWFudGEtb3RzdWRpbGEtdS1va3J1Z2EtbG9zLWFuZHpoZWxlcy0xNi1taWxsaW9ub3YtZG9sbGFyb3bSAYABaHR0cHM6Ly9mb2N1cy51YS91ay9hbXAvbGlmZXN0eWxlLzUyNjc4OC12ZG92YS1iYXNrZXRib2xpc3RhLWtvYmktYnJheWFudGEtb3RzdWRpbGEtdS1va3J1Z2EtbG9zLWFuZHpoZWxlcy0xNi1taWxsaW9ub3YtZG9sbGFyb3Y?hl=uk&gl=UA&ceid=UA%3Auk	http://news.google.com/articles/CBMiTmh0dHBzOi8vc3BvcnQudWEvdWsvbmV3cy80NzcyNTMta29iaS1icmF5YW50YS1pLWVnby1kb2NoLXBvaG9yb25pbGktNy1mZXZyYWx5YdIBUmh0dHBzOi8vc3BvcnQudWEvdWsvYW1wL25ld3MvNDc3MjUzLWtvYmktYnJheWFudGEtaS1lZ28tZG9jaC1wb2hvcm9uaWxpLTctZmV2cmFseWE?hl=uk&gl=UA&ceid=UA%3Auk	"ХТО: Ванесса Браянт — вдова Кобі Браянта, який загинув у авіакатастрофі разом із донькою Джіанною.

КОЛИ: Ситуація відбулася у січні 2020 року, а судовий процес над округом Лос-Анджелес за вторгнення в приватне життя — у 2023 році.

ДЕ: Основні події відбувалися в окрузі Лос-Анджелес, штат Каліфорнія. А авіакатастрофа, в якій загинула родина Браянтів, сталася над Калабасасом.

ЩО: Ванесса Браянт відсудила у округу Лос-Анджелес 16 млн доларів за те, що працівники екстрених служб фотографували тіла загиблих під час аварії вертольота, в якому перебували її чоловік — відомий баскетболіст Кобі Браянт та 13-річна дочка Джіанна. Фото були розіслані третім особам, через що родина позивача жила у страху перед публікацією цих знімків в інтернеті. Суд також розглянув позов Кріса Честера, який втратив у тій самій авіакатастрофі дружину та доньку. Йому присудили 15 млн доларів компенсації. 

Суд визнав факт вторгнення в приватне життя родини та встановив, що в департаменті шерифа відсутні суворі правила щодо фотографування на місці аварій, тож такі випадки мають непоодинокий характер. Ванесса Браянт планує перерахувати отриману компенсацію благодійним організаціям."	"ХТО: Кобі Брайант, його 13-річна донька Джianna та інші 5 людей, які загинули в авіакатастрофі.

КОЛИ: Похорони відбулися 7 лютого, а аварія гелікоптера сталася 26 січня. 

ДЕ: Меморіальний парк Pacific View в Корона-дель-Мар, Каліфорнія.

ЩО: Легендарний гравець НБА Кобі Брайант та ще 7 людей, включаючи його доньку Джианну, загинули в авіакатастрофі. 26 січня гелікоптер, в якому вони перебували, розбився в Калабасасі. 7 лютого в Меморіальному парку Pacific View відбулися похорони Кобі та Джанни. Офіційна церемонія прощання запланована на 24 лютого на арені «Стейплс-центр», яка належить «Лос-Анджелес Лейкерс»."	somewhat_related	В одній зі статей окрім Браянта, його сім'ї та інших людей загиблих в авіакатастрофі та їхніх родин, згадуються працівники екстрених служб (помічники шерифа) і присяжні в Лос-Анджелесі	Обидві статті про події навколо однієї теми - авіакатастрофи Кобі Браянта та інших.	Похорон був 7 лютого 2020 року, дружина Брайнта виграла суд через кілька років	Суд був в окрузі Лос Анджелес (незрозуміло, де конкретно), похорон - у Меморіальному парку Pacific View в Корона-дель-Мар, Каліфорнія, тобто все відбувалося в Каліфорнії, хоч і не в одному місці (відповідь, що в одній зі статей не вказане місце подій, теж підійшла б)	"ХТО: Ванесса Браянт – вдова Кобі Браянта, який загинув у авіакатастрофі разом із донькою Джіанною.

КОЛИ: Судовий процес відбувся у 2020 році, після того, як у січні того ж року стався нещасний випадок.

ДЕ: Подія відбулася в Лос-Анджелесі, а судовий процес проходив у присяжних Лос-Анджелеса.

ЩО: Ванесса Браянт отримала компенсацію в розмірі 16 млн доларів США після того, як працівники екстрених служб фотографували тіла загиблих під час аварії вертольота, в якому перебували її чоловік – знаменитий баскетболіст Кобі Браянт та донька Джіанна. Фото були поширені серед друзів та знайомих працівників екстрених служб. Ванесса разом із чоловіком баскетболіста Крісом Честером, який також втратив у тій авіакатастрофі дружину та доньку, подали до суду за емоційну шкоду. Суд визнав округ Лос-Анджелес винним у вторгненні в приватне життя та зобов'язав виплатити Ванессі Браянт та Честеру відповідно по 16 та 15 мільйонів доларів."	"ХТО: Легендарний гравець НБА Кобі Брайант та його 13-річна донька Джianna.

КОЛИ: Похорони відбулись 7 лютого, а гелікоптер з Брайантом та іншими пасажирами на борту розбився 26 січня.

ДЕ: Авіакатастрофа відбулася в місті Калабасас,  похоронна церемонія — в Меморіальному парку Pacific View в Корона-дель-Мар, Каліфорнія, а офіційна церемонія прощання запланована на 24 лютого на арені «Лос-Анджелес Лейкерс» «Стейплс-центр».

ЩО: Кобі Брайант, його донька Джianna та ще 7 людей загинули під час аварії гелікоптера. 7 лютого відбулись їх похорони, на яких були присутні численні відомі люди. Церемонія пройшла в Меморіальному парку, а згодом заплановано офіційну церемонію прощання на арені «Лос-Анджелес Лейкерс»."	true	000290928b--667025f483050a611035e1b7	infinite	89	92.134834
