INPUT:text1	INPUT:text2	INPUT:result	INPUT:comment	INPUT:source1	INPUT:source2	INPUT:summ_text1	INPUT:summ_text2	INPUT:main_result	INPUT:explanation_who	INPUT:explanation_what	INPUT:explanation_when	INPUT:explanation_where	INPUT:summ_with_documents_text1	INPUT:summ_with_documents_text2	GOLDEN:understood	TASK:id	TASK:overlap	TASK:assignments_count	TASK:correct_answers_percent
"Енергоблок №1 Рівненської АЕС відключили від енергомережі для проведення середнього планово-попереджувального ремонту, розрахованого на 45 діб.

Про це повідомляє прес-служба НАЕК ""Енергоатом"".

Зазначається, що енергоблок відключили 6 січня о 10:23 відповідно до графіку ремонтів та згідно з узгодженою заявкою.

""Наразі в роботі перебувають три енергоблока Рівненської АЕС. Сумарна потужність генераторів становить 2 430 МВт. Зауважень до роботи основного устаткування діючих енергоблоків та персоналу немає.

Реклама:

Радіаційний, протипожежний та екологічний стан на Рівненській АЕС і прилеглій території не змінювався й перебуває у межах діючих норм"", - йдеться у повідомленні.

Довідка: Рівненська АЕС розташована на північному-заході Рівненської області, в 120 км від м. Рівне, в Володимирецькому районі, на березі річки Стир.

РАЕС щорічно виробляє близько 19 млрд. кВт*год електроенергії, що становить 21,6% від виробництва атомними електростанціями, або 12% від загального виробництва електроенергії в Україні.

На РАЕС експлуатується чотири енергоблоки: І блок (ВВЕР-440) потужністю 420 тис кВт з 1980 року, ІІ блок (ВВЕР-440) потужністю 415 тис кВт з 1981 року, ІІІ блок (ВВЕР-1000) потужністю 1 млн кВт з 1986 року, ІV блок (ВВЕР-1000) потужністю 1 млн кВт з 2004 року.



Економічна правда"	"Рівненська АЕС підключила до мережі перший енергоблок після завершення капітального планово-попереджувального ремонту.

Про це повідомляє Енергоатом у вівторок, 26 лютого, пише «Слово і Діло».

«25 лютого 2019 року о 20:38 енергоблок №1 (ВВЕР-440) Рівненської АЕС підключено до енергомережі після проведення капітального планово-попереджувального ремонту. Проводиться планове підвищення потужності блоку», - йдеться в повідомленні.

Станом на ранок сьогоднішнього дня в роботі перебувають всі чотири енергоблоки Рівненської АЕС із сумарним навантаженням 2730 МВт. Зауважень до роботи основного устаткування діючих енергоблоків та персоналу немає.

«Порушень меж і умов безпечної експлуатації не було. Радіаційний, протипожежний та екологічний стан на РАЕС і прилеглій території не змінювався та перебуває у межах діючих норм», - зазначили в Енергоатомі.

Нагадаємо, 25 лютого на Запорізькій АЕС відключився від мережі енергоблок №3. Тоді повідомлялося, що відключення сталося дією захисту від внутрішніх пошкоджень генератора.

Отримуйте оперативно найважливіші новини та аналітику від «Слово і діло» в вашому VIBER-месенджері."	"{""where_same"":""yes"",""when_same"":""no"",""who_same"":""yes""}"	Зміна статусу роботи Енергоблоку №1 на Рівненській АЕС	http://news.google.com/articles/CBMiMWh0dHBzOi8vd3d3LmVwcmF2ZGEuY29tLnVhL25ld3MvMjAyMC8wMS83LzY1NTU1Mi_SATpodHRwczovL3d3dy5lcHJhdmRhLmNvbS51YS9uZXdzLzIwMjAvMDEvNy82NTU1NTIvaW5kZXguYW1w?hl=uk&gl=UA&ceid=UA%3Auk	http://news.google.com/articles/CBMib2h0dHBzOi8vd3d3LnNsb3ZvaWRpbG8udWEvMjAxOS8wMi8yNi9ub3Z5bmEvZWtvbm9taWthL3Jpdm5lbnNrYS1hZXMtemFwdXN0eWxhLXBlcnNoeWotZW5lcmhvYmxvay1waXNseWEtcmVtb250ddIBc2h0dHBzOi8vd3d3LnNsb3ZvaWRpbG8udWEvYW1wLzIwMTkvMDIvMjYvbm92eW5hL2Vrb25vbWlrYS9yaXZuZW5za2EtYWVzLXphcHVzdHlsYS1wZXJzaHlqLWVuZXJob2Jsb2stcGlzbHlhLXJlbW9udHU?hl=uk&gl=UA&ceid=UA%3Auk	"ХТО: Рівненська АЕС

КОЛИ: Енергоблок №1 відключили від енергомережі 6 січня

ДЕ: Рівненська область, Володимирецький район

ЩО: Енергоблок №1 Рівненської АЕС відключили від енергомережі на два місяці для проведення середнього планово-попереджувального ремонту. Відповідне відключення відбулося відповідно до графіку та без будь-яких ускладнень чи зауважень до роботи устаткування чи персоналу. РАЕС - одна з найбільших АЕС України, яка щороку виробляє близько 19 мільярдів кВт*год електроенергії, що становить близько 12% від загального виробництва електроенергії в країні. На станції працюють чотири енергоблоки різної потужності, останній з яких був запущений у 2004 році."	"ХТО: Рівненська АЕС та компанія Енергоатом

КОЛИ: 25 лютого 2019 року, у вівторок

ДЕ: Рівненська АЕС

ЩО: Рівненська АЕС підключила до енергомережі перший енергоблок після завершення капітального ремонту. Енергоблок №1 (ВВЕР-440) був підключений о 20:38 після проведення ремонту. Планується підвищення потужності блоку. Всі чотири енергоблоки АЕС працюють, їхня сумарна потужність становить 2730 МВт. Станція працює в нормальному режимі, без зауважень. Радіаційний, протипожежний та екологічний стан не змінювався і перебуває під контролем. Відомо, що раніше, 25 лютого, відключився від мережі енергоблок №3 Запорізької АЕС через пошкодження генератора."	somewhat_related	НАЕК Енергоатом повідомляє про роботу Рівненської АЕС	Події різні, але вони обидві пов'язані з темою, зазначеною вище. Тема специфічна, не широка, тому відповідь така.	25 лютого 2019 року та 6 січня 2020 року	Події відбуваються на енергоблоці №1 Рівненської АЕС	"1. Головною дійовою особою є Рівненська атомна електростанція (РАЕС), а саме її енергоблок № 1, який було відключено від енергомережі для проведення ремонту.
2. Відключення енергоблоку № 1 відбулося 6 січня о 10:23.
3. РАЕС розташована на північному заході Рівненської області, за 120 км від міста Рівне.
4. Енергоблок № 1 Рівненської АЕС був відключений від енергомережі на два з половиною місяці для проведення середнього планово-попереджувального ремонту. Це було зроблено відповідно до графіка та не вплинуло на роботу інших енергоблоків станції. РАЕС щороку виробляє близько 19 мільярдів кВт*год електроенергії, тобто близько 12 % української електроенергетики. Станція повідомила, що радіаційний, протипожежний та екологічний стан не змінювався і перебуває у межах норми."	"ХТО: Головною дійовою особою є Рівненська АЕС, яка підключила до мережі перший енергоблок після завершення ремонту. Також згадується Енергоатом, який повідомляв про цю подію.

КОЛИ: 26 лютого повідомлялось, що попереднього дня, 25 лютого, о 20:38 був підключений до енергомережі енергоблок № 1 Рівненської АЕС після завершення ремонту.

ДЕ: Подія відбулася на Рівненській АЕС.

ЩО: Енергоблок № 1 Рівненської АЕС був відключений від мережі 25 лютого о 20:38 через дії захисту від внутрішніх пошкоджень генератора. Після завершення ремонту блок знову підключили до мережі через добу. За словами представників Енергоатому, під час експлуатації енергоблоків не було жодних зауважень, радіаційний, протипожежний та екологічний стан на РАЕС не змінювався і залишався безпечним."	true	000290928b--667025f483050a611035e1b3	infinite	89	92.134834
