INPUT:text1	INPUT:text2	INPUT:result	INPUT:comment	INPUT:source1	INPUT:source2	INPUT:summ_text1	INPUT:summ_text2	INPUT:main_result	INPUT:explanation_who	INPUT:explanation_what	INPUT:explanation_when	INPUT:explanation_where	INPUT:summ_with_documents_text1	INPUT:summ_with_documents_text2	GOLDEN:understood	TASK:id	TASK:overlap	TASK:assignments_count	TASK:correct_answers_percent
"У Китаї фіксують спалах мікоплазменної пневмонії серед дітей. Хворі не мають кашлю та характерних симптомів цього захворювання.

На півночі Китаю різко зросла кількість випадків респіраторних захворювань, особливо серед дітей, що спричинило дискусії про загрозу нової пандемії через чотири роки після того, як у країні вперше з'явився COVID-19.

Про це повідомляє Independent.

Китай сколихнула хвиля незрозумілих респіраторних захворювань серед дітей, що змушує світових вчених поспішати з’ясувати причину – і визначити, чи може захворювання поширитися далі.

Китайські органи охорони здоров'я 13 листопада заявили, що зростання захворюваності є поєднанням уже відомих вірусів і пов'язане з першим повним сезоном застуди в країні після зняття суворих обмежень щодо Covid торік у грудні та циркуляцією відомих патогенів, включно з грипом, мікоплазмовою пневмоніюю, респіраторно-синцитіальним вірусом (РСВ) та SARS-CoV-2 – вірусом, що викликає COVID-19.

Також читайте Врятували життя: сини віддали своєму хворому батьку нирку та печінку

Всесвітня організація охорони здоров’я та Міжнародне товариство з проблем інфекційних хвороб висловили занепокоєння і надіслали до Китаю відповідні запити.

""Зі спалахом пневмонії в Китаї дитячі лікарні в Пекіні, Ляоніні та інших місцях були переповнені хворими дітьми, а школи та класи були на межі призупинення навчання"", – пише видання.

Міністерство охорони здоров’я Китаю попросило місцеву владу збільшити кількість клінік для лікування лихоманки, але органи охорони здоров’я наполягають, що не виявили ""незвичайних або нових захворювань"" і стверджують, що хвиля захворювань пов’язана з одночасною циркуляцією кількох типів патогенів, найпоширенішим з яких є грип.

Наразі недостатньо даних, щоб висунути остаточний вердикт щодо таємничої хвилі захворювання у Китаї. Експерти у Великій Британії підкреслили, що наразі немає доказів того, що в цьому винен новий вірус.

Натомість, найімовірніше, це пов’язано зі скасуванням Китаєм обмежень щодо Covid торік у грудні, а також може бути опосередковано пов’язано з епідемією серйозного гепатиту, яка спостерігалася у сотень дітей у Британії минулого року.

""Я не збираюся натискати кнопку паніки щодо пандемії на основі того, що ми знаємо на цей момент, але я буду дуже зацікавлений побачити оцінку ВООЗ після цього"", – заявив провідний експерт з охорони здоров’я Браян Макклоскі.

Доктор Занія Стаматакі, вірусний імунолог із Бірмінгемського університету, вважає: ""Наразі немає доказів того, що збільшення випадків дитячої пневмонії в Китаї може бути спричинене новим вірусом"".

На рентгенівських знімках грудної клітки деяких пацієнтів виявили легеневі вузлики – аномальні новоутворення.

За словами одного з професорів, це зазвичай вказує на бактеріальну, а не вірусну причину"".

Легеневі вузлики можна помітити у дітей з бактеріальною пневмонією, тоді як вторинні бактеріальні інфекції у тих, хто хворіє на грип, також можуть спричинити ""плямисті зміни"" на рентгенівських знімках грудної клітки, сказав він, додавши: ""Також може існувати більше, ніж одна інфекційна причина поточної пневмонії"".

Також читайте Мама показала шокувальні знімки свого наркозалежного сина з різницею в декілька місяців – фото

Багато експертів також підкреслили той факт, що Китай вступає в першу зиму після скасування багаторічних карантинних заходів торік у грудні, які, за словами професора Баллу, ""мабуть, різко зменшили циркуляцію респіраторних мікробів і, отже, знизили імунітет до ендемічних мікробів"".

""Інші країни, включно з Великою Британією, зазнали великих хвиль респіраторних інфекцій і госпіталізацій дітей під час першої зими після скасування пандемічних обмежень. Оскільки Китай пережив набагато довший і суворіший карантин, ніж практично будь-яка інша країна, передбачалося, що хвилі ""виходу з карантину"" можуть бути значними в Китаї. Поточна хвиля в країні, ймовірно, викликана різними респіраторними патогенами, такими як RSV або грип"", – сказав професор Баллу.

Професор Девід Гейманн із Лондонської школи гігієни та тропічної медицини погодився, що за хвилею хвороби, ймовірно, стоять сезонні інфекції, але додав, що завдання полягає в тому, щоб ""розпізнати спалахи та визначити причину"".

Нагадаємо, у ВООЗ прокоментували ситуацію у Китаї.

Читайте також:"	"Вірус у Піднебесній поклав на лікарняні ліжка десятки тисяч жителів Пекіна

Відсутність достатньої інформації про спалах захворювання від китайської влади спричинила підозри про нову загрозу епідемії. Через це на початку минулого тижня влада Тайваню порадила людям похилого віку, дуже молодим і тим, хто має проблеми з імунітетом, уникати поїздок на материк, а ближче до кінця минулого тижня група сенаторів-республіканців на чолі з Марко Рубіо закликали Президента Джо Байдена взагалі заборонити авіасполучення з Китаєм.

ПОЧАТОК «НЕДІАГНОСТОВАНОЇ ПНЕВМОНІЇ»

Історія з ознаками нової епідемії почалась наприкінці листопада з публікації авторитетної програми моніторингу захворювань ProMed (скорочено від Program for Monitoring Emerging Diseases), що відстежує спалахи захворювань людей та тварин по всьому світу. Отож 22-го листопада ProMed повідомила про осередки «недіагностованої пневмонії» у дітей на Півночі Китаю.

Слід зауважити, що саме попередження ProMed у грудні 2019 року привернуло увагу до нового вірусу в Китаї, який пізніше став відомий як SARS-CoV-2, що спричиняє COVID-19. А раніше, на початку 2003-го, також ProMed відіграв вирішальну роль у виявленні, знову ж таки в Піднебесній, спалаху атипової пневмонії з високими 11% летальних випадків через вірус SARS-CoV-1.

Про велику кількість випадків невідомої пневмонії в дитячих лікарнях Пекіна, Ляоніна та інших міст північного Китаю першими розповіли і тайванське видання «FTV News» та гонконгське SCMP (South China Morning Post), опублікувавши відповідні фото. Медіа материкового Китаю традиційно не поспішали «сіяти паніку» серед читачів, у той час як популярні місцеві соцмережі «Вічат» і «Вейбо» публікували фото й відео переповнених лікарень, довжелезних черг дорослих із маленькими пацієнтами на руках і панічних підозр, що влада знову приховує щось дуже лихе.

Фото: Getty Images

У коментарях китайці найчастіше писали: «Дуже багато дітей госпіталізовано. Вони не кашляють і не мають симптомів. У них просто висока температура і лихоманка… Пацієнтам доводиться чекати в черзі по 2 години, хоча лікарі у відділеннях невідкладної допомоги працюють цілодобово…». Також розповідали про те, що школи почали забороняти дітям із будь-якими ознаками застуди відвідувати заняття, а все, що відбувається, навіть називали «державною таємницею».

На цьому тлі до Пекіна 22 листопада звернулася Всесвітня організація охорони здоров’я (ВООЗ) з проханням надати додаткову епідеміологічну та клінічну інформацію про потенційно тривожний сплеск респіраторних захворювань і пневмонії у дітей на Півночі Китаю. Після запиту ВООЗ ця тема, власне, й набула широкого публічного розголосу по світу.

Китайська влада відповіла вже наступного дня та поінформувала організацію, що в поточному спалаху зареєстровані симптоми є загальними для кількох респіраторних захворювань і їхні прояви зумовлені відомими патогенами, з якими люди вже давно мають справу. Нових збудників пневмонії не виявлено, тому підстав для занепокоєння немає, це просто відносно великий сезонний сплеск.

ВООЗ прийняла цю відповідь і наголосила, що уважно стежить за ситуацією та перебуває у тісному контакті з владою Китаю.

ВІРУСИ Й НЕТИПОВІ ОЗНАКИ

Висновки китайських лікарів та епідеміологів про «звичайність» нинішнього спалаху респіраторних захворювань базуються на твердженні, що їхньою основною причиною є грип, а хворіють не лише діти, а й дорослі. Водночас діти до 4 років, крім грипу, хворіють назальним вірусом, від 5 до 14 років – мікоплазмовою пневмонією та аденовірусом, дорослі люди – риновірусом та коронавірусом, а пацієнти віком від 60 років – метапневмовірусом, теж респіраторним захворюванням. Інакше кажучи, всі відомі випадки в Китаї діагностовані й нових чи незвичайних патогенів виявлено не було.

Фото: Longhua Liao/Getty Images

Китайські фахівці переконували, що постійно відслідковують ситуацію і ще в травні зафіксували початок зростання амбулаторного та госпіталізаційного лікування дітей від мікоплазмової пневмонії, поширеного респіраторного патогена, який часто спричинює дитячу пневмонію. До цього в жовтні додався різкий сплеск дитячих захворювань, спричинених іншими збудниками, такими як респіраторно-синцитіальний вірус (РСВ), аденовірус та вірус грипу.

Проте перелічені вірусні інфекції давно відомі й добре піддаються лікуванню протимікробними й іншими препаратами. То в чому ж нетиповість цього разу?

Першою ознакою є швидкість поширення і масштаб. Сплеск припав на останні дні листопада, коли в Китаї у середньому реєстрували близько 7 тисяч нових хворих щодоби. Тоді у Пекінському міському управлінні охорони здоров’я повідомляли, що в столиці з населенням (зареєстрованим і незареєстрованим) понад 25 мільйонів лише за один тиждень із 20 до 26 листопада було відмічено майже 72 500 випадків, тобто більше 10 тисяч щодня.

Така ж ситуація була в інших великих містах північного Китаю. Наприклад, дитяча лікарня сусіднього з Пекіном муніципалітету Тяньцзінь (населення близько 15 мільйонів), як повідомляло одне з місцевих видань, працювала цілодобово, обслуговуючи щодня рекордні 13 тисяч пацієнтів у амбулаторних відділеннях та відділеннях невідкладної допомоги.

Головною причиною незвично великої кількості випадків респіраторних захворювань китайські експерти в галузі охорони здоров’я вважають накладення на фактор сезонності наслідків трирічних жорстких карантинів через COVID-19. Китай лише в грудні минулого року почав поступово скасовувати антиковідні обмеження, через які діти змушені були фактично увесь час проводити вдома в колі рідні й були позбавлені можливості природно зміцнювати свій імунітет.

Ще одну ознаку нетиповості лікарі встановили уже в ході лікування пацієнтів, коли виявили стійкість бактерій до макролідів – групи антибіотиків, які зазвичай ефективно лікують респіраторні захворювання, зумовлені мікобактеріальними інфекціями, збудниками мікоплазмової пневмонії. Зазвичай бактеріальні інфекції супроводжуються легкими респіраторними симптомами, проте цього разу китайські експерти та офіційні особи заявили, що спалах виявився особливо серйозним.

Фахівці материкового Китаю вже тривалий час попереджають про мікоплазмову пневмонію, стійку до макролідів. Ще в 2013 році вчені з Китайського центру контролю та профілактики захворювань зазначали, що, ймовірно, через часте вживання ліків на основі антибіотиків рівень резистентності (стійкості до антибіотика) серед пацієнтів у Пекіні був вищим, ніж у решті країни, а це суттєво підвищує ризики важкого перебігу хвороби як у дорослих, так і в їх дітей.

ВООЗ: ЗАГРОЗИ ЕПІДЕМІЇ НЕМАЄ

Проте окремі нетипові ознаки цьогорічного сезону респіраторних захворювань не змінюють висновку вірусологів про відсутність так званої загадкової пневмонії, що може спровокувати нову епідемію.

«Цієї зими не було виявлено нових інфекційних захворювань, спричинених новими вірусами чи бактеріями, а всі гострі респіраторні захворювання, про які тепер повідомляють у країні, зумовлені відомими збудниками», – заявив на пресконференції 2 грудня речник Національної комісії з охорони здоров’я КНР Мі Фен.

Керівник Китайського центру грипу Ван Даянь тоді ж зазначила, що віруси грипу схильні до мутацій, і це може створювати певні проблеми для його профілактики й лікування.

«Результати засвідчили, що противірусні препарати, які тепер використовують для лікування, ефективні проти нинішніх вірусів грипу», – сказала Ван. За її словами, китайські науковці тісно співпрацюють із лабораторіями й колегами з різних країн, аби знайти способи протидії зменшенню чутливості вірусів грипу до противірусних засобів.

Ван розповіла, що домінувальними підтипами вірусу грипу в Китаї цієї зими є грип A (H3N2) і грип B, які не змінилися порівняно з минулим роком, і вони також відповідають домінувальним штамам, що циркулюють у більшості країн світу, та порадила вакцинуватись, аби запобігти важким випадкам.

«Вакцинація може ефективно знизити ризик інфікування, захворювання та важких ускладнень», – наголосила вірусолог.

Подібні висновки й поради дає і ВООЗ. Представниця організації Маргарет Харріс заявила, що вони вважають сплеск мікоплазмової пневмонії серед дітей у Китаї нормальним явищем для зимового періоду і не бачать загрози нової пандемії.

Вивчивши інформацію, яку надав Китай, ВООЗ не пропонує запровадження жорстких карантинних заходів і рекомендує жителям Китаю вакцинуватись проти грипу, COVID-19 та інших респіраторних патогенів, бути на відстані від хворих людей, залишатися вдома під час хвороби, носити маски та регулярно мити руки. Пройти противірусну вакцинацію, уникати скупчення людей, носити маску та мити руки ВООЗ радить і тим, хто планує подорож до Піднебесної.

Чи виправдане таке оцінювання ВООЗ подій у Китаї? Напевно так, оскільки, крім авторитету міжнародної організації, висновкам якої апріорі потрібно довіряти, цього року перевищення епідеміологічного порогу респіраторних захворювань виявлені і в інших країнах, та й у деяких регіонах України.

Наприклад, данський Statens Serum Institute, який моніторить інфекційні захворювання, 29 листопада повідомив, що зараження мікоплазмовою пневмонією в країні досягло епідемічного рівня, зазначивши, що зростання захворюваності почалося ще у серпні, а наприкінці листопада відбувся різкий стрибок. Також спалах мікоплазмової пневмонії зафіксовано у Франції, де більшість хворих – діти.

Схоже, цього року дійсно йдеться про незвично різкий сплеск респіраторних інфекцій у всьому світі, спричинений збігом кількох факторів, і підстав остерігатися нової епідемії немає. У кожному разі, потрібно самим бути уважними, піклуватись про власний імунітет, виконувати поради лікарів і своєчасно робити необхідну профілактику.

Володимир Сидоренко, Пекін

Перше фото: Getty Images"	"{""where_same"":""partly"",""when_same"":""yes"",""who_same"":""partly""}"	Незрозуміла пневмонія серед дітей, що призвела до переповнення лікарень у Китаї в листопаді-грудні 2023 року, викликає занепокоєння, однак, згідно з думкою різних всесвітніх організацій охорони здоров'я, є результатом падіння імунних сил унаслідок тривалого карантину в Китаї через covid-19	http://news.google.com/articles/CBMieWh0dHBzOi8vdHNuLnVhL3N2aXQvdS1raXRheWktc3BhbGFoLW5ldmlkb21veWktcG5ldm1vbml5aS1zZXJlZC1kaXRleS1jaGktcG9zaGlyaXRzeWEtZXBpZGVtaXlhLXphLW1lemhpLWtuci0yNDYwMDEwLmh0bWzSAX1odHRwczovL3Rzbi51YS9hbXAvc3ZpdC91LWtpdGF5aS1zcGFsYWgtbmV2aWRvbW95aS1wbmV2bW9uaXlpLXNlcmVkLWRpdGV5LWNoaS1wb3NoaXJpdHN5YS1lcGlkZW1peWEtemEtbWV6aGkta25yLTI0NjAwMTAuaHRtbA?hl=uk&gl=UA&ceid=UA%3Auk	http://news.google.com/articles/CBMigwFodHRwczovL3d3dy51a3JpbmZvcm0udWEvcnVicmljLWhlYWx0aC8zNzk1OTk1LW5lZGlhZ25vc3RvdmFuYS1wbmV2bW9uaWEtc28tdmlkb21vLXByby1zcGxlc2stcmVzcGlyYXRvcm5paC16YWh2b3J1dmFuLXUta2l0YWkuaHRtbNIBhwFodHRwczovL3d3dy51a3JpbmZvcm0udWEvYW1wL3J1YnJpYy1oZWFsdGgvMzc5NTk5NS1uZWRpYWdub3N0b3ZhbmEtcG5ldm1vbmlhLXNvLXZpZG9tby1wcm8tc3BsZXNrLXJlc3BpcmF0b3JuaWgtemFodm9ydXZhbi11LWtpdGFpLmh0bWw?hl=uk&gl=UA&ceid=UA%3Auk	"ХТО: Діти на півночі Китаю, у яких виявляють незрозуміле респіраторне захворювання. 

КОЛИ: Спалах захворювання відбувся після скасування Китаєм суворих карантинних заходів, пов'язаних з COVID-19, у грудні 2022 року.

ДЕ: Північ Китаю, зокрема Пекін та провінція Ляонін. 

ЩО: У Китаї фіксують зростання випадків незрозумілої пневмонії серед дітей, яка не має кашлю та характерних симптомів цього захворювання. ВООЗ та міжнародні експерти стурбовані ситуацією і збирають інформацію. Китайські офіційні особи заявляють, що це поєднання відомих вірусів, але світові експерти шукають нову причину хвороби. На рентгенівських знімках у хворих виявляють легеневі вузлики, що може вказувати на бактеріальну, а не вірусну причину захворювання. Експерти припускають, що це може бути пов'язано зі скасуванням карантину та зниженням імунітету населення до ендемічних мікробів."	"ХТО: Китай, Тайвань, США (сенатори-республіканці на чолі з Марко Рубіо), Всесвітня організація охорони здоров'я (ВООЗ).

КОЛИ: кінець листопада 2022 року - початок грудня 2022 року.

ДЕ: Північ Китаю, Пекін, Тайвань, США, Данія, Франція.

ЩО: Спалах невідомої форми пневмонії у дітей на півночі Китаю наприкінці листопада 2022 року викликав занепокоєння іншої епідемії після COVID-19. Тайванська та гонконгська преса повідомляла про переповнені дитячі лікарні, а китайські соцмедіа - про «державну таємницю». ВООЗ звернулася до Китаю з проханням надати інформацію про спалах захворювання, на що китайська сторона відповіла, що це сезонний сплеск відомих респіраторних патогенів. Фахівці відзначили швидкість поширення і масштаби захворювання, а також його нетипові ознаки: хворіють люди різного віку, а бактерії демонструють стійкість до макролідів. Проте, за висновками китайських та міжнародних експертів, зокрема ВООЗ, ситуація не несе в собі загрози епідемії, а є сезонним сплеском респіраторних захворювань, спричинених відомими патогенами. Вони рекомендують вакцинацію та дотримання санітарно-гігієнічних заходів."	similar	Здебільшого головні особи в статтях збігаються (діти в Північному Китаї та ВООЗ), але в одній статті є такі особи, як Мі Фен, Ван Даянь, Маргарет Гарріс, а в іншій - Брайан Макклоскі, Доктор Занія Стаматакі, Девід Гейманн	Обидві статті про одну й ту саму подію - епідемію серед дітей у Північному Китаї	Епідемія відбувається, очевидно, в один і той самий час	Загалом, обидві статті пишуть про Північний Китай, але в одній зі статей так само фокус на Велику Британію	"ХТО: Основними персонажами цієї новини є діти на півночі Китаю, в яких виявили незвичні респіраторні захворювання, а також експерти та організації з охорони здоров'я, що поспішають встановити причину цих симптомів та визначити, чи може захворювання поширюватися далі.

КОЛИ: Спалах захворювання стався осені - 13 листопада та через чотири роки після появи у країні COVID-19.

ДЕ: Події відбуваються на півночі Китаю, зокрема в Пекіні, Ляоніні та інших місцях, де дитячі лікарні були переповнені хворими.

ЩО: На півночі Китаю фіксують раптовий спалах респіраторних захворювань у дітей, що викликає занепокоєння та дискусії щодо можливої нової пандемії. Симптоми не відповідають характерним ознакам пневмонії, тому китайські органи охорони здоров'я наразі не виявили ""незвичайних або нових захворювань"", пов'язуючи їх появу із циркуляцією відомих патогенів, натомість Всесвітня організація охорони здоров'я та міжнародні експерти з інфекційних хвороб надсилають до Китаю запити та висловлюють стурбованість ситуацією. На рентгенівських знімках у деяких пацієнтів виявили легеневі вузлики, що може вказувати на бактеріальну природу хвороби. Експерти також припускають, що хвиля захворювань пов'язана зі скасуванням у Китаї суворих карантинних заходів торік у грудні та зниженням імунітету населення до ендемічних мікробів."	"ХТО: Основною дійовою особою у новині є жителі Пекіна, яких десятки тисяч госпіталізували через спалах невідомої пневмонії. Іншою ключовою особою є китайська влада, яка запевняла, що ситуація під контролем і не була причиною для занепокоєння.

КОЛИ: Спалах захворювання почався наприкінці листопада 2022 року, коли за один тиждень у Пекіні зареєстрували майже 72 500 випадків хвороби. 

ДЕ: Події розгорталися mostly в Пекіні та інших великих містах північного Китаю на кшталт Тяньцзінь. Проте, пізніше стало відомо про випадки хвороби в інших країнах, зокрема у Франції та Данії.

ЩО: Відсутність інформації про причину спалаху захворювання від китайської влади викликала занепокоєння у всьому світі. ВООЗ звернулася до Китаю з проханням надати більше інформації про ситуацію 22 листопада. Китайські офіційні особи запевнили, що це звичайний сезонний сплеск відомих респіраторних захворювань, спричинених відомими патогенами, і немає потреби панікувати. Проте, експерти відзначили, що це нетиповий спалах через швидкість поширення, вік хворих, масштаб та через стійкість бактерій до групи антибіотиків - макролідів. ВООЗ не запропонувала запровадження жорстких карантинних заходів, порадивши жителям Китаю вакцинуватися та дотримуватися заходів гігієни."	true	000290928b--667025f483050a611035e1b5	infinite	88	89.77273
