INPUT:text1	INPUT:text2	INPUT:result	INPUT:comment	INPUT:source1	INPUT:source2	INPUT:summ_text1	INPUT:summ_text2	INPUT:main_result	INPUT:explanation_who	INPUT:explanation_what	INPUT:explanation_when	INPUT:explanation_where	INPUT:summ_with_documents_text1	INPUT:summ_with_documents_text2	GOLDEN:understood	TASK:id	TASK:overlap	TASK:assignments_count	TASK:correct_answers_percent
"Двоповерховий автобус зі старшокласниками з німецького Марбурга розбився у федеральній землі Саар на шляху до Англії.

Про це, як пише ""Європейська правда"", повідомляє Welt.

27 учнів середньої школи в Марбурзі, а також водій автобуса постраждали в неділю в аварії за участю автобуса на автобані 45 у Саарі. Поліція Дортмунда повідомила, що три дівчини та хлопець отримали серйозні травми та перебувають у лікарні. Але загрози життю немає.

фото DPA

Легко травмованого 54-річного водія автобуса також доставили до лікарні, 16 дівчат і сім хлопців, які отримали легкі травми, також отримали медичну допомогу. Вчителі, які їх супроводжували, залишилися неушкодженими, але були в шоковому стані.

Реклама:

Згідно з інформацією, загалом 67 учнів віком 14 і 15 років, а також п’ятеро вчителів прямували з Марбурга на шкільну екскурсію до Англії, коли о 6:27 біля Вендена в районі Ольпе автобус потрапив у ДТП. За попередніми даними, автобус виїхав направо та перекинувся на бік.

Автобан у напрямку Дортмунда має бути повністю закритий протягом дня, щоб можна було перемістити автобус.

За даними поліції, шкільну екскурсію скасували та організували повернення до Марбурга. Розповіли, що кілька батьків уже забрали своїх дітей.

Раніше у квітні у німецькому місті Гольцмінден 16 учнів були доставлені до лікарень після аварії зі шкільним автобусом.

Нагадаємо, у грудні у Німеччині під час сильної ожеледі сталася ДТП за участю шкільного автобуса, у якій загинула одна дитина."	"У ніч на неділю, 2 червня, в американському штаті Огайо сталася масштабна стрілянина, внаслідок якої загинула одна людина, а ще 26 отримали поранення.

Про це повідомляє Cleveland 19 News.

Як зазначається, поліція міста Акрон заявила, що отримала опівночі у неділю виклик із інформацією, що під час стрілянини на вулиці поранено декількох людей.

Коли офіцери поліції прямували на місце події, медики заявили, що декілька людей прибули до відділень невідкладної допомоги з вогнепальними пораненнями. Поліція зазначила, що на місці події вилучено зброю.

Згідно з даними правоохоронців, загалом постріли були здійснені в 27 людей, внаслідок перестрілки 27-річний чоловік загинув. Про стан інших постраждалих не повідомляється.

Нагадаємо, 15 травня було скоєно замах на прем'єра Словаччини Роберта Фіцо після виїзного засідання уряду у місті Хандлов. Чоловік кілька разів вистрілив у політика перед місцевим Будинком культури. У мережі було опубліковано відео замаху.

Після стрілянини Фіцо відвезли до місцевої лікарні. У його канцелярії повідомляли, що політик перебуває у тяжкому стані.

Окрім цього, нещодавно в турецькому місті Адияман сталася стрілянина у відділку поліції. Один з правоохоронців відкрив вогонь по працівнаках поліції. Внаслідок стрілянини загинули двоє людей, ще вісім були поранені."	"{""when_same"":""no"",""where_same"":""no"",""who_same"":""no""}"	Автобус зі школярами, що перекинувся в Німеччині, в Саарі - ця трагедія не має нічого спільного зі стріляниною в штаті Огайо, внаслідок якої 27 осіб постраждали	http://news.google.com/articles/CBMiO2h0dHBzOi8vd3d3LmV1cm9pbnRlZ3JhdGlvbi5jb20udWEvbmV3cy8yMDI0LzA0LzIxLzcxODQzMDcv0gEA?hl=uk&gl=UA&ceid=UA%3Auk	http://news.google.com/articles/CBMic2h0dHBzOi8vd3d3LnNsb3ZvaWRpbG8udWEvMjAyNC8wNi8wMi9ub3Z5bmEvc3ZpdC9zc2hhLXN0YWxhc3lhLW1hc3NodGFibmEtc3RyaWx5YW55bmEteWUtemhlcnR2YS1kZXN5YXRreS1wb3JhbmVueXjSAXdodHRwczovL3d3dy5zbG92b2lkaWxvLnVhL2FtcC8yMDI0LzA2LzAyL25vdnluYS9zdml0L3NzaGEtc3RhbGFzeWEtbWFzc2h0YWJuYS1zdHJpbHlhbnluYS15ZS16aGVydHZhLWRlc3lhdGt5LXBvcmFuZW55eA?hl=uk&gl=UA&ceid=UA%3Auk	"ХТО: 27 учнів середньої школи з Марбурга та їхній водій.

КОЛИ: В неділю.

ДЕ: На автобані 45 у німецькій федеральній землі Саар.

ЩО: Двоповерховий автобус, який віз 27 учнів середньої школи та їхніх вчителів в Англію, потрапив у серйозну аварію. Три дівчини та хлопець отримали серйозні травми і були госпіталізовані, а також водій автобуса отримав легкі травми. Автобус з'їхав з дороги та перекинувся на бік. Поліція розслідує причину ДТП. Через аварію автострада у напрямку Дортмунда була повністю блокована. Шкільна екскурсія була скасована, і дітей повернули додому. Це не перша така аварія за участі шкільного автобуса в Німеччині - у квітні та грудні минулого року також були серйозні ДТП за участі шкільних автобусів, у яких постраждали діти."	"ХТО: Стрілянину в Огайо влаштував 27-річний чоловік, через його дії одна людина загинула, а 26 отримали поранення. А перед цим у Словаччині було скоєно замах на прем'єра Роберта Фіцо, а в Туреччині - на відділок поліції, де загинули двоє людей.

КОЛИ: Масштабна стрілянина в Огайо відбулася в ніч на неділю, 2 червня. Замах на Роберта Фіцо відбувся 15 травня, а стрілянина в Туреччині - у відділенні поліції - сталася невдовзі після цього.

ДЕ: Події розгорталися в американському штаті Огайо, specifically на вулиці міста Акрон. У Словаччині замах на прем'єра відбувся перед місцевим Будинком культури в місті Хандлов. А в Туреччині - у місті Адияман, у відділку поліції.

ЩО: В результаті стрілянини в Огайо одна особа загинула, а 26 отримали поранення; поліція прибала на місце події і виявила зброю. Це вже другий за останній час інцидент зі стріляниною в цьому штаті. Замах на прем'єра Словаччини залишив його у важкому стані, а в результаті стрілянини в Туреччині загинули двоє правоохоронців. Обидві події показують зростання насильства з використанням зброї у цих регіонах."	different	школярі з Марбургу, водій, поліція Дортмунда і поліція в Акроні та 27-річний стрілець в Огайо, нічого спільного	Абсолютно дві різні події, в основному завданні вам треба буде коротко викласти їх обидві, як зроблено вище	2 червня 2024 року та район середини квітня 2024 року	Різні країни, Німеччина та Америка	"ХТО: 27 учнів середньої школи у Марбурзі та їх 54-річний водій автобуса.

КОЛИ: У неділю о 6:27.

ДЕ: Автобан 45 у Саарі, неподалік Вендена в районі Ольпе.

ЩО: Двоповерховий автобус, який віз 27 учнів та п'ятеро вчителів зі старшої школи з німецького Марбурга в Англію, потрапив у аварію. За словами поліції Дортмунда, автобус з'їхав у праву сторону та перекинувся на бік. У результаті аварії постраждали 27 учнів та їх водій, чотири людини отримали серйозні травми, а решта - легкі. Усі постраждалі були доставлені до лікарні, їхньому життю нічого не загрожує. Шкільна екскурсія була скасована, а дітей повернули до Марбурга. Через аварію автобан у напрямку Дортмунда був повністю закритий протягом дня.

Ця подія є не єдиною аварією шкільного автобуса в Німеччині. Раніше у квітні в місті Гольцмінден аварія за участю шкільного автобуса призвела до госпіталізації 16 учнів, а в грудні минулого року - до загибелі дитини через сильну ожеледицю."	"ХТО: Нападником виявився 27-річний чоловік, який відкрив стрілянину і вбив одну людину, а ще поранив 26 людей. among them was also a politician Robert Fico, who survived the attack.

КОЛИ: Стрілянина відбулася опівночі у неділю, 2 червня. А замах на політика Роберта Фіцо стався 15 травня.

ДЕ: Інцидент із стріляниною відбувся у штаті Огайо, на вулиці міста Акрон. А напад на Роберта Фіцо відбувся у місті Хандлов.

ЩО: У штаті Огайо відбулася стрілянина, за участі 27-річного стрільця, внаслідок якої 1 особа загинула та ще 26 отримали поранення різного ступеня тяжкості. Правоохоронці вилучили зброю на місці події. Окрім того, у своїй відповіді я розповіла про замах на прем'єра Словаччини Роберта Фіцо, який відбувся 15 травня та про стрілянину у відділку поліції в турецькому місті Адияман, де правоохоронець відкрив вогонь по колегах, в результаті чого загинуло двоє людей та восьмеро було поранено."	true	000290928b--667025f483050a611035e1b9	infinite	90	94.44444
